{
  "build": "1.26.70.22",
  "version": "1.26.70-preview.22",
  "channel": "preview",
  "binary": {
    "linux": {
      "url": "https://www.minecraft.net/bedrockdedicatedserver/bin-linux-preview/bedrock-server-1.26.70.22.zip",
      "sha256": "035afd811e8c1b61d0ddee66d6e449eab992ae332173728f7c61e495cfefe9b6",
      "size": 101494898,
      "supported": false
    },
    "windows": {
      "url": "https://www.minecraft.net/bedrockdedicatedserver/bin-win-preview/bedrock-server-1.26.70.22.zip",
      "sha256": "2fd7479c09582e75301fbf442cb8200eb29987ac358571c63d74558cc74a3fa2",
      "size": 106531384,
      "supported": false
    }
  }
}
