{
  "build": "1.26.51.1",
  "version": "1.26.51",
  "channel": "release",
  "binary": {
    "linux": {
      "url": "https://www.minecraft.net/bedrockdedicatedserver/bin-linux/bedrock-server-1.26.51.1.zip",
      "sha256": "ad91d3b824e51ea50b5bb601c295cbd8f543a29b14315c2ad89ff27311e2d860",
      "size": 94926669,
      "supported": true
    },
    "windows": {
      "url": "https://www.minecraft.net/bedrockdedicatedserver/bin-win/bedrock-server-1.26.51.1.zip",
      "sha256": "a1c1ebefde3036223234179f7c1eab4b445b4727f0482a0554818c9bcaf8e4a5",
      "size": 85766110,
      "supported": true
    }
  }
}
