{
  "build": "1.17.40.06",
  "version": "1.17.40",
  "channel": "release",
  "binary": {
    "linux": {
      "url": "https://www.minecraft.net/bedrockdedicatedserver/bin-linux/bedrock-server-1.17.40.06.zip",
      "sha256": "e7c60d935c259c82d7843a79fd073180a6f746c87fbc4e5c5b0313b0ae064871",
      "size": 61479303,
      "supported": true
    },
    "windows": {
      "url": "https://www.minecraft.net/bedrockdedicatedserver/bin-win/bedrock-server-1.17.40.06.zip",
      "sha256": "84703d4b4e2dfb0c7aecc9904247b3b6b23c051468862bd1390cfb0cb130b8db",
      "size": 41499115,
      "supported": true
    }
  }
}
